{
  "$schema": "../widget.schema.json",
  "title": "디스크 사용량",
  "icon": "💽",
  "description": "드라이브별 사용량을 게이지로 보여 주는 예제. PowerShell 명령을 60초마다 실행합니다.",
  "defaultSize": { "w": 320, "h": 160 },
  "minSize": { "w": 160, "h": 120 },
  "command": {
    "run": "Get-PSDrive -PSProvider FileSystem | Where-Object Used | Select-Object Name,Used,Free | ConvertTo-Json",
    "shell": "powershell",
    "parse": "json",
    "interval": 60,
    "timeout": 10
  }
}
