{
  "$schema": "../widget.schema.json",
  "title": "시스템",
  "icon": "📊",
  "description": "CPU·메모리·GPU·디스크·네트워크 사용량을 실시간으로 표시",
  "entry": "index.tsx",
  "provider": "sysmon",
  "defaultSize": { "w": 360, "h": 270 },
  "minSize": { "w": 220, "h": 150 },
  "settingsSchema": [
    { "key": "showGpu", "label": "GPU 표시", "type": "boolean", "default": true },
    { "key": "showCores", "label": "코어별 막대", "type": "boolean", "default": true },
    { "key": "showHistory", "label": "60초 히스토리", "type": "boolean", "default": true },
    { "key": "showNet", "label": "네트워크 속도", "type": "boolean", "default": false },
    { "key": "showTop", "label": "CPU 상위 프로세스", "type": "boolean", "default": false },
    { "key": "topCount", "label": "프로세스 개수", "type": "number", "default": 4, "min": 1, "max": 12, "step": 1 },
    { "key": "disks", "label": "디스크 (쉼표로 여러 개)", "type": "text", "default": "C:", "placeholder": "C:, D:" }
  ]
}
