{
  "$schema": "../widget.schema.json",
  "title": "메모 · 할 일",
  "icon": "📝",
  "description": "인스턴스별로 독립된 메모와 할 일 목록",
  "entry": "index.tsx",
  "provider": "notes",
  "defaultSize": { "w": 280, "h": 240 },
  "minSize": { "w": 180, "h": 100 },
  "settingsSchema": [
    { "key": "title", "label": "목록 이름", "type": "text", "default": "할 일", "placeholder": "업무, 장보기…" },
    { "key": "showDone", "label": "완료한 항목도 표시", "type": "boolean", "default": true },
    { "key": "strikeDone", "label": "완료한 항목에 취소선", "type": "boolean", "default": true }
  ]
}
