{
  "$schema": "../widget.schema.json",
  "title": "Claude 한도",
  "icon": "✨",
  "description": "Claude 5시간·주간 사용 한도와 남은 시간을 표시",
  "entry": "index.tsx",
  "provider": "claude_usage",
  "defaultSize": { "w": 340, "h": 170 },
  "minSize": { "w": 200, "h": 100 },
  "settingsSchema": [
    { "key": "showOpus", "label": "주간 Opus 한도도 표시", "type": "boolean", "default": false },
    { "key": "showLocalCost", "label": "로컬 추정 비용 표시 (오늘/7일)", "type": "boolean", "default": false },
    { "key": "krwRate", "label": "원화 환율 (0=숨김)", "type": "number", "default": 1380, "min": 0, "step": 10 }
  ]
}
